average_salary,city_state,company_id,company_info,company_name,company_rating,country_name,job_desc,job_title,post_date
,Rome,10471,"[('Headquarters', 'Walldorf, Germany'), ('Size', '10000+ employees'), ('Founded', '1972'), ('Type', 'Company - Public\r\n                                    (SAP)'), ('Industry', 'Information Technology'), ('Revenue', '$10+ billion (USD) per year'), ('Competitors', 'Salesforce, Oracle, Microsoft')]",SAP,4.4,Italy,"Requisition ID: 168504 Work Area: Presales Expected Travel: 0 - 20% Career Status: Professional Employment Type: Regular Full Time COMPANY DESCRIPTION As market leader in enterprise application software, SAP helps companies of all sizes and industries innovate through simplification. From the back office to the boardroom, warehouse to storefront, on premise to cloud, desktop to mobile device – SAP empowers people and organizations to work together more efficiently and use business insight more effectively to stay ahead of the competition. SAP applications and services enable customers to operate profitably, adapt continuously, and grow sustainably.  SAP Commercial Sales is looking for a presales consultant for its Barcelona office to drive the digital sales motion and support sales team. If you are results-driven and creative, if success as a team is a key driver, if you love the frenzy that comes with victories, if you are looking for a multicultural work environment that rewards excellence and over-achievement, then feel free to apply.    If you want to know more about what a Presales Consultant does, here is a short video: https://video.sap.com/media/t/0_yo9x1els    What is a presales consultant?    The Presales Consultant possesses advanced knowledge of SAP and partner software solutions and participates in sales cycles as a member of the virtual account team in support of the sales account strategy. A Presales Consultant interacts with prospective customers through discovery conversations, product solution demonstrations, executive presentations and follow-up discussions.     What a presales consultant’s day looks like?   Compose and deliver superior sales presentations covering SAP and partner software solutions to prospective customer audiences. The presentations must articulate the sales message, differentiate SAP, and leave a strong and positive impression to audiences which can include senior company executivesPrepare and deliver value-based software demonstrations/presentations in support of sales cycles. Preparation includes personalization of materials to ensure delivery of a simple, appealing and compelling customer presentationIn advance of a demonstration or key presentation, conduct discovery sessions with representatives from the prospective customer to build relationships with the customer and understand their unique needsDemonstrate deep knowledge of SAP solutions and appropriate industries to maintain credibility with prospective customers. Provide proof points with relevant customer storiesSupport RFx completion in support of customer proposalsAbility to effectively present to customers “remotely” using virtual technologies (SAP Virtual Studio)Provide limited post-sale support to key customers primarily to the project/implementation team to ensure a smooth transitionSupport one-to-many sales and marketing events both on-site and remotelySupport Design Thinking workshops to promote new and innovative solutions for customers and prospects.   What are the experience & language requirements?   5 years’ experience as Solution Architect or Enterprise ArchitectExcellent presentation and digital communication skills (video, visual tools)IT technical knowledge and experience in IT infrastructure, coding, data management:Cognizant of the latest technology trends in, not limiting to, BigData, Internet-of-Things, Blockchain, Cloud solutions, Machine Learning, Rapid Deployment, User Experience, Mobility, Predictive, Data Virtualization, Enterprise Data Management, etcGood knowledge of main OS (Windows, Linux)Good knowledge of Java programmingGood knowledge of internet protocols / paradigms (http, soap web services, rest web services, API, HTML5, JSP, CSS, XML, Json)Good knowledge of mobile programming (Android Studio, Eclipse)Good or basic knowledge of Internet of Things related technologies (Raspberry, Arduino)Basic knowledge of cross platform framework (Javascript, Angular JS, Jquery, Apache Cordova, Apache PhoneGap)Basic knowledge of database programming    This role is based in Barcelona and covers the Italian territory. As such, fluency in Italian is required (native tongue preferred) and proficiency in Spanish is an advantage.    If you want to know more about SAP Commercial, here is a short video:    URL: https://www.youtube.com/watch?v=uXAzSm6OxMs     #SAPCommercialSales #SAPCommercialSalesEMEA SAP'S DIVERSITY COMMITMENT To harness the power of innovation, SAP invests in the development of its diverse employees. We aspire to leverage the qualities and appreciate the unique competencies that each person brings to the company.  SAP is committed to the principles of Equal Employment Opportunity and to providing reasonable accommodations to applicants with physical and/or mental disabilities. If you are interested in applying for employment with SAP and are in need of accommodation or special assistance to navigate our website or to complete your application, please send an e-mail with your request to Recruiting Operations Team (Americas: Careers.NorthAmerica@sap.com or Careers.LatinAmerica@sap.com, APJ: Careers.APJ@sap.com, EMEA: Careers@sap.com). Requests for reasonable accommodation will be considered on a case-by-case basis.    Read moreSee All",Presales Consultant - Bilingual Italian and English Job (relocation to Barcelona), 10 days ago
,Cinisello Balsamo,1737,"[('Headquarters', 'Redwood City, CA'), ('Size', '10000+ employees'), ('Founded', '1977'), ('Type', 'Company - Public\r\n                                    (ORCL)'), ('Industry', 'Information Technology'), ('Revenue', '$10+ billion (USD) per year'), ('Competitors', 'SAP, Salesforce, Microsoft')]",Oracle,3.4,Italy,"Sells a subset of product or services directly or via partners to a large number of named accounts/non-named accounts/geographical territory (mainly Tier 3 accounts).  Primary job duty is to sell technology software products and related services in a defined territory. Identifies, qualifies and closes new opportunities. Manages accounts including the entire sales process from business development prospecting and specifications through contract negotiations, signing, and post-sales support. Leverages the Oracle sales model to maximize revenue growth and increase local market share. Builds and expands business partner revenue and self sufficiency.  Leading contributor individually and as a team member, providing direction and mentoring to others. Work is non-routine and very complex, involving the application of advanced technical/business skills in area of specialization. 8 years applicable experience including 7 years of technology sales experience. Ability to forecast, manage sales expenses, and successfully close new Oracle business. Business development, prospecting and presentation skills. Excellent communication skills and problem solving ability. Proven track record of exceeding sales objective and territory/account development. Experience as the focal point for clients for all sales and related issues. Oracle knowledge and/or knowledge of Oracle*s competitors. Travel may be needed. Bachelor degree or equivalent. As part of Oracle's employment process candidates will be required to complete a pre-employment screening process, prior to an offer being made. This will involve identity and employment verification, salary  verification, professional references, education verification and professional qualifications and memberships (if applicable). Senior Sales Representative Cloud, Technology, Middleware, Big Data, Data integration, Security – Commercial Accounts - Milan  Are you as passionate about the Cloud as we are ?  We  are seeking a motivated sales individual who can sell our most complete  all technology solutions portfolio to a number of customers cross  industry in Italy. You will impress your customers talking about: our  market leading database for the Cloud , Middleware Solutions, Cloud Paas  and IaaS , BI & Big data, Security, Data Integration, Api,  BlockChain Technology, Intelligent Chat bots, DevOps…etc You will help  your customers, who have growing data volumes and aggressive  service-level expectations, maximize the potential of their IT  organizations while delivering the real-time enterprise. Join us and  become the trusted advisor of your clients. Responsibilities Develop Cloud/Database/Middleware/BI/Big data/Security…etc Sales  opportunities and maintain customer relationships in your given  territory. The right candidate should be able to orchestrate a  speech across the complete offering of Oracle in front of a client and  work alongside other internal teams to be one Oracle for the customer. Promote and evangelize Oracle products to selected retail customers, partners, and internal audiencesDevelop relationships and collaborate with our partners to define, recommend, and drive salesDevelop and execute a sales plan that provides complete territory and sector specific coverage Develop appropriate sales programs and solutions; maintain up-to-date  competitive information and compile regional success stories Meet with senior customer contacts to build credibility and develop lasting relationshipsEngage with Pre-Sales support for customer meetings to develop customer discussions furtherLead successful go-to-market campaigns by working closely with internal marketing specialistsContribute and lead in account planning, customer/market analysis, and strategy sessionsContribute individually and as a team member, providing direction and mentoring to othersRequired Skills 5 years of experience in direct software sales to Education sector in  all of Italy. Local market knowledge and experience is a must  Good understanding of the data center customer needs and strong  technical expertise to become a trusted advisor across the wide  technology portfolio. Proven track record in a sales-driven organization, selling technology-related products and servicesSolid written, verbal, and presentation skillsCreative with strong problem-solving skills and an ability to succeed in a fast-paced environmentProven ability to work well as part of an extended sales teamKnowledge of Oracle products preferred but not essentialFluency in English and ItalianTeam player and self-motivatedEligible to work in Italy. We do not sponsor work permit As part of Oracle’s employment process candidates will be required to complete a pre-employment screening process, prior to an offer being made. This will involve identity and employment verification, salary verification, professional references, education verification and professional qualifications and memberships (if applicable).  Read moreSee All",Cloud Platform Sales Representative, 2 days ago
,Cinisello Balsamo,1737,"[('Headquarters', 'Redwood City, CA'), ('Size', '10000+ employees'), ('Founded', '1977'), ('Type', 'Company - Public\r\n                                    (ORCL)'), ('Industry', 'Information Technology'), ('Revenue', '$10+ billion (USD) per year'), ('Competitors', 'SAP, Salesforce, Microsoft')]",Oracle,3.4,Italy,"Sells a subset of product or services directly or via partners to a large number of named accounts/non-named accounts/geographical territory (mainly Tier 3 accounts).  Primary job duty is to sell technology software products and related services in a defined territory. Identifies, qualifies and closes new opportunities. Manages accounts including the entire sales process from business development prospecting and specifications through contract negotiations, signing, and post-sales support. Leverages the Oracle sales model to maximize revenue growth and increase local market share. Builds and expands business partner revenue and self sufficiency.  Leading contributor individually and as a team member, providing direction and mentoring to others. Work is non-routine and very complex, involving the application of advanced technical/business skills in area of specialization. 8 years applicable experience including 7 years of technology sales experience. Ability to forecast, manage sales expenses, and successfully close new Oracle business. Business development, prospecting and presentation skills. Excellent communication skills and problem solving ability. Proven track record of exceeding sales objective and territory/account development. Experience as the focal point for clients for all sales and related issues. Oracle knowledge and/or knowledge of Oracle*s competitors. Travel may be needed. Bachelor degree or equivalent. As part of Oracle's employment process candidates will be required to complete a pre-employment screening process, prior to an offer being made. This will involve identity and employment verification, salary  verification, professional references, education verification and professional qualifications and memberships (if applicable). Senior Sales Representative Cloud, Technology, Middleware, Big Data, Data integration, Security –Italy  Are you as passionate about the Cloud as we are ? Are you a conqueror able to convert strategic  We  are seeking a motivated sales individual who can sell our most complete  all technology solutions portfolio. You will impress your customers  talking about: our market leading database for the Cloud , Middleware  Solutions, Cloud Paas and IaaS , BI & Big data, Security, Data  Integration, Api, BlockChain Technology, Intelligent Chat bots,  DevOps…etc You will help your customers, who have growing data volumes  and aggressive service-level expectations, maximize the potential of  their IT organizations while delivering the real-time enterprise. Join  us and become the trusted advisor of your clients. Responsibilities Develop Cloud/Database/Middleware/BI/Big data/Security…etc Sales  opportunities and maintain customer relationships in a given vertical  industry. The right candidate should be able to orchestrate a  speech across the complete offering of Oracle in front of a client and  work alongside other internal teams to be one Oracle for the customer. Promote and evangelize Oracle products to selected retail customers, partners, and internal audiencesDevelop relationships and collaborate with our partners to define, recommend, and drive salesDevelop and execute a sales plan that provides complete territory and sector specific coverage Develop appropriate sales programs and solutions; maintain up-to-date  competitive information and compile regional success stories Meet with senior customer contacts to build credibility and develop lasting relationshipsEngage with Pre-Sales support for customer meetings to develop customer discussions furtherLead successful go-to-market campaigns by working closely with internal marketing specialistsContribute and lead in account planning, customer/market analysis, and strategy sessionsContribute individually and as a team member, providing direction and mentoring to othersRequired Skills 5-10 years of experience in direct software sales to complex/Large  Enterprises . Local market knowledge and experience is a must Experience in the Financial Sector industry Good understanding of the data center customer needs and strong  technical expertise to become a trusted advisor across the wide  technology portfolio. Proven track record in a sales-driven organization, selling technology-related products and servicesSolid written, verbal, and presentation skillsCreative with strong problem-solving skills and an ability to succeed in a fast-paced environmentProven ability to work well as part of an extended sales teamKnowledge of Oracle products preferred but not essentialFluency in English and ItalianTeam player and self-motivated As part of Oracle’s employment process candidates will be required to complete a pre-employment screening process, prior to an offer being made. This will involve identity and employment verification, salary verification, professional references, education verification and professional qualifications and memberships (if applicable). Read moreSee All",Technology Sales Representative IV, 2 days ago
,Rome,10471,"[('Headquarters', 'Walldorf, Germany'), ('Size', '10000+ employees'), ('Founded', '1972'), ('Type', 'Company - Public\r\n                                    (SAP)'), ('Industry', 'Information Technology'), ('Revenue', '$10+ billion (USD) per year'), ('Competitors', 'Salesforce, Oracle, Microsoft')]",SAP,4.4,Italy,"Requisition ID:169068 Work Area: Consulting and Professional Services Expected Travel: 50-100% Career Status: Professional Employment Type: Regular Full Time COMPANY DESCRIPTION As you know, SAP’s vision is to help the world run better and improve people’s lives.  As THE cloud company powered by SAP HANA®, SAP is a market leader in enterprise application software, helping companies of all sizes and industries Run Simple.  We empower people and organizations to work together more efficiently and use business insight more effectively. SAP applications and services enable our customers to operate profitably, adapt continuously, and grow sustainably.  At SAP, we believe in the power of collaboration and empower our employees to perform at their best in an environment that encourages free and open expression of ideas. Here, you work alongside creative thinkers who share your intets, while turning big ideas into reality for our customers. With innovative job training, mentors to help you grow, and the flexibility to balance your work and personal life, you’re able to build your career. It’s no wonder that some of the sharpest minds from around the world are working for a company that is consistently recognized as a global top employer.    PURPOSE AND OBJECTIVES    SAP provides a comprehensive range of enterprise software applications and business solutions and supports leading companies worldwide in creating benefits.     As the management consultancy of SAP, SAP Business Transformation Services supports customers in identifying value creation potential in the planning of strategic IT projects, and support customers on their journey. The aim is to create flexible, cross-company processes, thereby significantly influencing enterprises' growth, profitability, and strategic positioning against their competition.     A major factor for doing so successfully is to identify and fulfill customers' requirements, both from an IT perspective and in relation to the affected business departments. SAP Business Transformation Services uses strategic analysis, plans, and implementation scenarios to add value to companies by:    Developing and realizing business and IT strategies within the Process IndustriesCreate, evaluate and proof digital business scenarios for our customers on SAP’s latest technologiesPreparing investment decisions based on detailed business case examinationsProvide transformation support in various roles during realization EXPECTATIONS AND TASKS   Being an industry and/or SAP solution expert in at least one of the mentioned industries, proofed in responsible roles in IT or BusinessHelping customers leverage innovation methodologies, such as “design-thinking”, to create and develop new business processes and business models powered by innovative technologies (e.g., Internet of Things, machine learning, blockchain, Data Science)Developing and realizing innovation strategy for customers in the relevant industriesLeading innovative and strategic proof-of-concept projects and implementation projects in the area of innovation (e.g., predictive maintenance, predictive quality, Digital SCM, etc.)Leading/ Supporting business and IT architecture designSupporting customers in big Transformation projects as trusted advisorGenerating opportunities and support sales around innovation, including bid and proposal managementInvestigating and sharing knowledge on industry and technology trendsInvestigating new technology and establishing a network with SAP product teams, SAP partners and SAP development to support continuous development of use cases for our customersPresent and discuss ideas, technology capabilities, business impacts, etc. with C-levels and experts also including data scientists   EDUCATION AND QUALIFICATIONS / SKILLS AND COMPETENCIES   Master degree in Business Administration, engineering, IT, mathematics, physics or equivalent (PhD preferred)Digital strategy and innovation experience or deep SAP solution experienceKnowledge of SAP solution portfolio (new portfolio preferred like S/4HANA Core or Suite, SAP Leonardo, SAP cloud platform)Excellent communication & presentation skill (oral, written) at all levels of an organizationGood knowledge on current technology trends and their impact on the relevant industriesVery good learning skills, systematic thinkerStrong project management or Change Management skillsFluent English & German Optional: Design-thinking experience and agile development experience preferredExperience in business process and business model innovation preferred  WORK EXPERIENCE   5+ years’ work experience as consultant, experience in process Industries preferred   SAP'S DIVERSITY COMMITMENT To harness the power of innovation, SAP invests in the development of its diverse employees. We aspire to leverage the qualities and appreciate the unique competencies that each person brings to the company.  SAP is committed to the principles of Equal Employment Opportunity and to providing reasonable accommodations to applicants with physical and/or mental disabilities. If you are interested in applying for employment with SAP and are in need of accommodation or special assistance to navigate our website or to complete your application, please send an e-mail with your request to Recruiting Operations Team (Americas: Careers.NorthAmerica@sap.com or Careers.LatinAmerica@sap.com, APJ: Careers.APJ@sap.com, EMEA: Careers@sap.com). Requests for reasonable accommodation will be considered on a case-by-case basis.    Read moreSee All","Sen/Pr Digital Transformation Consultant for Chemical, Life Science or Agriculture Industry", 5 days ago
