average_salary,city_state,company_id,company_info,company_name,company_rating,country_name,job_desc,job_title,post_date
,Argentina,762714,"[('Headquarters', 'Sunnyvale, CA'), ('Size', '201 to 500 employees'), ('Founded', '2001'), ('Type', 'Company - Private'), ('Industry', 'Information Technology'), ('Revenue', 'Unknown / Non-Applicable'), ('Competitors', 'Unknown')]",Altoros,4.4,Argentina,"About ProtofireProtofire is a special unit within Altoros that helps token-based protocols and developer platforms accelerate growth of their ecosystems. By providing hands-on coding and contributions, Protofire specializes in supercharging developer adoption and network usage.  Our goal is to help clients ship applications, engineer elegant smart contracts, craft awesome developer tools (SDKs/APIs/sample apps), and simply improve performance/cost of oracles. We work exclusively with entrepreneurs who are builders of decentralized infrastructure protocols, applications and ecosystems.About the QA Engineer positionWe are looking for a Quality Assurance (QA) engineer who will manage exploratory and automated tests to ensure product quality. You will design and implement tests, debug and define corrective actions, review system requirements and track quality assurance metrics (e.g. defect densities and open defect counts). Besides, you should monitor all stages of software development to identify and resolve system malfunctions to meet quality standards.  We expect you to be able to build consistent and efficient tests delivering them in-time. You should also hold an engineering background and enjoy providing end-to-end solutions to software quality problems and actively participate in open source communities and projects.QA Engineer responsibilities are: Prepare detailed, comprehensive and well-structured test plans and test casesReview requirements, specifications and technical design documents to provide timely and meaningful feedbackPlan and coordinate testing activities, thoroughly identifying and documenting bugsBuild and execute automation scripts using open source toolsOrganize testing processes for new and existing products to meet client needsCollaborate with internal teams (e.g. developers and product managers) to identify system requirementsReview debugging process resultsTrack quality assurance metrics, like defect densities and open defect countsAnalyze the causes of non-conforming software and train users to implement solutionsMaintain relevant knowledge about new testing tools and test strategiesQA Engineer requirements are:2+ years' experience of working on a QA Engineer positionSignificant experience of working in software development teams and using software QA methodologies and toolsSolid experience in writing clear, concise and comprehensive test plans and test casesSignificant experience with Load Testing, Performance Testing and Stress Testing.Experience with automated testing toolsUnderstanding of Agile/Scrum development principlesExperience with blockchain or distributed systems is a big plus.Regular contributions and participation in the open source community is also a big plus.BS or MS degree in Computer Science, Engineering or other related area Read moreSee All",QA Automation Engineer, 14 days ago
,La Plata,1058820,"[('Headquarters', 'Buenos Aires, Argentina'), ('Size', '1 to 50 employees'), ('Founded', 'Unknown'), ('Type', 'Company - Private'), ('Industry', 'Unknown'), ('Revenue', 'Unknown / Non-Applicable per year'), ('Competitors', 'Unknown')]",Aliantec,None,Argentina,"Para empresa Argentina que desarrolla software Web, Mobile, ofreces servicios de Testing e integración de aplicaciones principalmente para empresas de Estados Unidos estamos buscando un QA Automation Tester para trabajar en relación de dependencia directa en la zona de Palermo.  Su responsabilidad será realizar testing sobre una plataforma de criptomonedas en Estados Unidos, por lo cual es indispensable tener muy buen dominio de Ingles (oral y escrito).  Las principales funciones serán realizar pruebas de regresión y caso de pruebas sobre la plataforma actual y sobre el nuevo core que se está desarrollando con base en Blockchain.  Requerimientos Experiência realizando tareas de QA de al menos 3 años. (Excluyente)- Experiência testeando plataformas web con alta recurrencia. (Excluyente) y si tiene experiência en Mobile será valorado. Experiência en Automatización de tests (Selenium) y creando scripts con Java, Python y/o algun otro lenguaje. (Excluyente). Experiência con Metodologías Ágiles. (Excluyente)- Excelente nível de Ingles oral y escrito(Excluyente) Valoramos candidatos que sean estudiantes avanzados o graduados de Sistemas / Informática o carreras afines  Beneficios Prepaga de primer nível. Home Office (2 veces por semana). Horario Laboral de 9 a 18 hrs. Read moreSee All",Qa Automation Tester, 1 days ago
,Buenos Aires,1651,"[('Headquarters', 'Redmond, WA'), ('Size', '10000+ employees'), ('Founded', '1975'), ('Type', 'Company - Public\r\n                                    (MSFT)'), ('Industry', 'Information Technology'), ('Revenue', '$10+ billion (USD) per year'), ('Competitors', 'Google, Amazon, Apple')]",Microsoft,4.1,Argentina,"Microsoft Enterprise Services Apps Centre of Excellence (Apps COE) team in Americas is looking for a Solution Architect that can help build magical solutions for our customers to help with their digital disruption and transformations. The Apps COE team at Microsoft is responsible for leading the architecture and development of innovative, software applications as a part of our Digital Solution Innovation Process (DSIP). With an innovation focus, you should be confident in quickly developing skills in evolving technology areas with a track record of staying ahead of the curve.ResponsibilitiesAs the Solution Architect you will require both broad and deep technology knowledge and the ability to architect solutions by mapping common customer business problems to end-to-end technology solutions. You should be able to demonstrate theability to engage in senior level technology and business decision makers’ discussions related to agility, business value, and end to end information technology as a requirement. You are a key enabler for other architects, consultants and partners in our business. You need to be able to demonstrate a passion for the customer through professionalism and striving for excellence in all aspects of the customer engagement and experience. You need to be able to apply advanced analysis skills and experience in principals of architecture to define appropriate customer solutions. To be credible you should have current and deep experience with the development of large software systems. Also, you should understand competitive and open source technology and how to properly assess feasibility of migrating customer solutions from, and/or integrating with customer solutions hosted on, non-Microsoft platforms. Advanced domain knowledge in one or more vertical industry is also an asset.QualificationsYou need to be a leader with +10 years of experience in demonstrating architecture, planning, deploying solutions including the following: Proven solid experience on Azure application development /architecture, C# and .NET. Highly desired: Blockchain, Artificial Intelligence, IoT, Node.js and containers.+75% travel availability.English / Spanish fluent at spoken/written level.Proven experience selling consulting engagements which includes estimating, scoping, and writing effective statements of work that clearly set expectations and limit risk.Demonstrated excellence with consulting skills and presenting complex development topics to both business executive and technical personnel.Consistent record of building deep technical relationships with senior executives and helping to build innovative cloud solutions in large or highly strategic accounts.Consistent track record of driving decisions collaboratively, resolving conflicts and ensuring follow through with extraordinary verbal and written communication.Demonstrated excellence when facilitating customer design and awareness sessions that are focused on complex application solution architectures.Demonstrated capabilities in developing an understanding of the customer business value associated with the deployment of modern business productivity, system-to-system, and end-user applications.An ability to articulate architectural differences between solution methods and the challenges and approaches to integrating solutions built on different platforms including a working knowledge of different architectural frameworks (e.g. Togaf) that may be used by our customers.Architectural understanding of, and implementation experience with the software development of modern applications, especially cloud-based and hybrid solutions.Understand the approach, value and have the ability to lead Agile software development projects.Architectural understanding of both commercial and common Open Source solution development tools and technologies -Ability to move between high-level architectural review/design and the “roll up the sleeves” level of personally doing all phases of a software application delivery project. Helps customer account teams identify, pursue and close strategic business development opportunities while continually driving add-on business within existing projects. To accomplish this, you need to be effective in fostering executive level relationships. They also play a key role in employing and developing partners as part of the overall Microsoft services delivery model. You will help translate business requirements into technology requirements for inclusion in contracts and/or statements of work (SOW).You will be call upon to provide Technical Quality Assurance at various points along a project lifecycle. To be successful you should be able to demonstrate your experience leading projects through the entire project lifecycle. This includes managing multi-phase/multi-dimensional/multi-resource projects to conclusion while maintaining high customer satisfaction.The role requires an individual who is resourceful, confident under pressure, and has demonstrated skill in both crisis management and expectation management.You may come from an enterprise customer, partner and competing organizations and may have played the following types of roles in these organizations; Senior Architect, Chief Architect, Principal Architect or CTO. Microsoft is an equal opportunity employer. All qualified applicants will receive consideration for employment without regard to age, ancestry, color, family or medical care leave, gender identity or expression, genetic information, marital status, medical condition, national origin, physical or mental disability, political affiliation, protected veteran status, race, religion, sex (including pregnancy), sexual orientation, or any other characteristic protected by applicable laws, regulations and ordinances.  Benefits/perks listed below may vary depending on the nature of your employment with Microsoft and the country where you work. Read moreSee All",Solution Architect - Modern Applications, 5 days ago
,Argentina,354,"[('Headquarters', 'Armonk, NY'), ('Size', '10000+ employees'), ('Founded', '1911'), ('Type', 'Company - Public\r\n                                    (IBM)'), ('Revenue', '$10+ billion (USD) per year'), ('Competitors', 'Amazon, Accenture, Microsoft')]",IBM,3.6,Argentina,"Job DescriptionPostdoctoral Researcher AI SolutionsWork in 1 of 12 labs across the globeFixed Term Hire 24 Months ContractBased in Melbourne From landing the first astronauts on the moon to building the first AI system to win the Jeopardy! competition, IBM has been the spark of the technology revolutions that have shaped our world today.  At the core of IBMs innovation are its 12 global research labs. IBM Research - Australia is a vibrant and young community within IBM Research. The lab is primarily an industry solutions lab that focuses on conceiving, designing and building next generation systems that will transform health and life sciences and financial services with technologies such as AI, Internet of Things and Blockchain. Candidates will be joining a team of researchers and software engineers to conceive, build, test and deploy solutions for some of the worlds challenging technology problems. What will I be doing?Designing and developing novel AI techniques, including using NLP, to Financial Services and related industriesProactive both in publishing our work in top academic conferences as well as demonstrating its value with clients.Developing neural language models and publishing the outcomes in top academic conferences. What skills do I need?Experience in developing novel NLP and/or NLG models e.g. Neural Language Models for machine translation or abstractive summarizationBreadth of knowledge in the application of machine learning outside of NLPE.g. Kaggle competition experience.What experience do I need?A Doctorate degree in computer science or related related field completed in the last two years.Experience programming with one of Python / Scala / JavaIdeal candidates will have business experience and/or a demonstrated open source profile (e.g. github)Experience with deep learning for NLP on top of open source frameworks such as (Py-Torch; Keras; Theano; Caffe; Tensorflow; DL4J)Demonstrated academic output documented via journal/conference publications in the field e.g. ACL, NAACL, COLING  Are you passionate about delivering a tailored experience in a fast moving, innovative client facing environment? Are you able to captivate an audience and paint the art of the possible? Are you keen to promote and implement new ways of interacting with and visualising data? If so, wed like to hear from you! Apply today ibm.com.au/careers Required Technical and Professional Expertise  see Job Description  Preferred Tech and Prof Experience  see Job Description  EO Statement  IBM is committed to creating a diverse environment and is proud to be an equal opportunity employer. All qualified applicants will receive consideration for employment without regard to race, color, religion, gender, gender identity or expression, sexual orientation, national origin, genetics, disability, age, or veteran status. IBM is also committed to compliance with all fair employment practices regarding citizenship and immigration status.  Read moreSee All",Postdoctoral Researcher AI Solutions, Today
,Argentina,354,"[('Headquarters', 'Armonk, NY'), ('Size', '10000+ employees'), ('Founded', '1911'), ('Type', 'Company - Public\r\n                                    (IBM)'), ('Revenue', '$10+ billion (USD) per year'), ('Competitors', 'Amazon, Accenture, Microsoft')]",IBM,3.6,Argentina,"Job DescriptionResearch Internship Blockchain TechnologiesInternship duration: Fulltime 3 6 months  The World is Our Laboratory: No matter where discovery takes place, IBM researchers push the boundaries of science, technology and business to make the world work better. IBM Research is a global community of forward-thinkers working towards a common goal: progress.  IBM Research - Australia is a vibrant and relatively young community within IBM Research. The lab is primarily an industry solutions lab that focuses on conceiving, designing and building next generation systems that will transform various industries such as healthcare and financial services.  As an intern, you will be joining a team of researchers and software engineers to conceive and build innovative solutions for some of the worlds challenging computing problems. Specifically, in this role, you will be exploring research challenges and novel applications of the emerging blockchain technology. Required qualifications:Second year or later into a PhD candidature in Computer Science or related fieldSolid understanding of Distributed Systems, Algorithms and Software design patternsDemonstrable academic publication track recordPreferred qualifications:Familiarity with Blockchain concepts and technologies (Hyperledger Fabric, Corda and/or Ethereum)Contributions to open source projects (demonstrated through a GitHub profile)To be eligible to apply:You will need to be an Australian/New Zealand Citizen or Permanent residentYou will need to be a registered fulltime student Required Technical and Professional Expertise  .none  Preferred Tech and Prof Experience  .none  EO Statement  IBM is committed to creating a diverse environment and is proud to be an equal opportunity employer. All qualified applicants will receive consideration for employment without regard to race, color, religion, gender, gender identity or expression, sexual orientation, national origin, genetics, disability, age, or veteran status. IBM is also committed to compliance with all fair employment practices regarding citizenship and immigration status.  Read moreSee All",Research Internship Blockchain Technologies, 7 days ago
,Italy,4138,"[('Headquarters', 'Dublin, Ireland'), ('Size', '10000+ employees'), ('Founded', '1989'), ('Type', 'Company - Public\r\n                                    (ACN)'), ('Revenue', '$10+ billion (USD) per year'), ('Competitors', 'Cognizant Technology Solutions, EY, McKinsey & Company')]",Accenture,3.8,Italy,"Accenture biometric authentication, blockchain solution, biometric authentication, blockchain solution, WE SEEK CYBER TALENTS TO PROTECT THE BUSINESS OF OUR CLIENTS. JOIN ACCENTURE SECURITY AND DESIGN THE MOST INNOVATIVE CYBER SECURITY SOLUTIONS WITH US. Accenture Security design and implement the most innovative security solutions to give an answer to the  most complex Cyber attacks. Become an Accenture Security professional and ensure a straightforward approach to information security for a real business and technology revolution.  IDENTITY & ACCESS MANAGEMENT SECURITY CONSULTANT Milan, Rome Don't just follow the rules. Set them. Our consultants identify and evaluate security gaps and will help to create security project plans. They also anticipate security requirements and identify sound security controls for applications, systems, processes and organizations. Our consultants can easily work with non-security teams to integrate security controls on projects.  We are currently searching for consultants for our Security Technology practice who are familiar with Identity & Access Management products, including Oracle, CA, Forgerock, Sailpoint and others. Technical experience should include design and developing provisioning flows and adapters for assets, identity federation, mobile access, biometric authentication, blockchain solution, developing Role Based Access Control (RBAC) entitlements to web applications, implementing role resolution, role mining and role administration user interfaces. Key responsibilities may include: · Working with clients to develop Identity and Access Management strategies, architectures and implementation plans  · Configuration and Implementation of I&AM products and risk mitigation  · Design and develop automated provisioning and reconciliation of IT resources  · Request-based application and resource provisioning  · RBAC authentication to entitled applications and resources  · Identity Federation  · Strong authentication and biometrics · Blockchain  · Social Login  · Mobile Access  · Single Sign-on  Qualifications : · Minimum of a Master's degree in a technical field (e.g. Computer Science, CIS, MIS, Engineering)  · Strong Experience in design, implementation and deployment of IAM platforms  · Minimum 2+ years of experience with planning and implementing IAM capabilities, including:  o Identity Governance & Administration  o Access Management & Federation  o Directory Services  o Biometrics  o Blockchain  o Identity as a Service (IDaaS)  o Experience implementing packaged or custom IAM solutions, including but not limited to Oracle, IBM, CA, SailPoint, RSA/Aveksa, ForgeRock, Okta, Dell/Quest, PingIdentity · Professional Skills: o Eagerness to contribute in a team-oriented environment  o Ability to work creatively and analytically in a problem-solving environment  o Desire to work in an information systems environment  o Excellent communication (written and oral) and interpersonal  o Industry-adopted security certification (e.g. CISSP)  Best People, Best Training & Best Work: start your adventure at the top Find out how to bring your ideas and creativity to life in a  young, creative, friendly and dynamic environment .  Structured and customized training is designed to help you build your own firmly grounded professional career by developing both  technical and  management skills.  Become part of a global network renowned for the quality of its people and services, manage complex and challenging projects, and test emerging technologies.  When there are no limits to passion, there is no limit to innovation. A world of opportunities We provide  professional and technological services across more than 40 industries and in all business areas. Approximately  435,000 experts in over  120 countries enable us to furnish a wide range of end-to-end services and solutions integrating  strategy, consulting, digital, technology and operations for 94 of the FORTUNE® Global 100 and around 80% of the FORTUNE® Global 500, as well as governments around the world.  Inclusion & Diversity Our  Inclusion & Diversity strategy aims to break down all barriers and eliminate prejudice. We are committed to providing an accessible, inclusive, open and welcoming workplace environment for people with different abilities, backgrounds, lifestyles, sexual orientation, gender identity, needs and expectations, helping all individuals to make the most of their professional potential.  We honor our commitments under articles 1 and 18 of Law No. 68/1999 and give special consideration to candidates in  protected categories .  For further information, visit our website: professioni.accenture.it  For information on our Privacy Protection Safeguards (art13 L.196/03), click here .  Accenture is an equal opportunities employer. Read moreSee All",Identity & Access Management Security Consultant, 7 days ago
