average_salary,city_state,company_id,company_info,company_name,company_rating,country_name,job_desc,job_title,post_date
,Italy,4138,"[('Headquarters', 'Dublin, Ireland'), ('Size', '10000+ employees'), ('Founded', '1989'), ('Type', 'Company - Public\r\n                                    (ACN)'), ('Revenue', '$10+ billion (USD) per year'), ('Competitors', 'Cognizant Technology Solutions, EY, McKinsey & Company')]",Accenture,3.8,Italy,"Accenture DISRUPTIVE TECHNOLOGY IS TRANSFORMING BANKING AND INSURANCE AT THEIR CORE.JOIN ACCENTURE CONSULTING TO MEET THE CHALLENGE AND LEAD THE DIGITAL REVOLUTION OF FINANCIAL SERVICES. Make the most of your talent and seize the opportunity to dive into world's largest companies join our global  Technology Advisory team of experts, learn how to enable most innovative technologies like Robotics, AI, Blockchain, IoT, design forward-thinking Digital Architecture that evolve with Client business.  Become an innovation advocate to our Clients and lead them today to the future of Technology. Help us drive the change in  Financial Services , help us win tomorrow market challenges.  TECHNOLOGY ADVISORY DIGITAL VALUE ARCHITECT Milan Play your part in projects focused on  Financial Services, get to know top managers of leading Italian banks, and become part of a prominent leader in the industry. Enjoy the challenge of large scale projects, supporting companies that are  investing the most on innovation .  Don't just follow the rules. Set them. · Evaluate, identify and design new digital architecture and platform  · Build relationships with Client IT departments C-suite in order to discuss and play the role of advisor on Technology topics and trends  · Plan and define IT and Digital transformation roadmap (Journey to cloud, DevOps set up, )  · Lead architecture transformation design and delivery projects  · Research (i.e. Gartner magic quadrants, IDC reports), gather information, interpret and compare data, and shape a solution  · Analyze market products maturity (i.e. SWOT Matrix) and design a customized solution based on client ecosystem  · Create, review and certificate architectural design and documentation  · Manage end-to-end project phases  · Translate technology solutions into business value  · Manage junior resources growth and encourage team members to think creatively as well as keep them motivated  Opportunities · Maximize your CV's ROI through a distinctive, innovative and compelling work experience  · Expand your industry knowledge and professional network joining Community of Practices and a dynamic and young environment  · Attend to international classes held by subject matter experts and understand Accenture corporate culture  · Access to internal and external Certification programs to deepen and prove your most relevant skills  Qualifications : What makes the difference · 2-3 years in similar role in consulting firms or premium multi-national firms (consultant)  · 4-5 years in similar role in consulting firms or premium multi-national firms (manager)  · High standing, communication and presentation skills  · Deep knowledge and experience on multilayer complex architectures  · Knowledge of main technology trends (Robotics, AI, Blockchain, IoT, .)  · Experience with service oriented architecture (SOA) and their governance approaches  · Knowledge of architectural styles and design patterns  · Broad and extensive experience with most adopted technologies  · More relevant web X.0 technologies (i.e. ajax, css, angular ...)  · Deep knowledge of main architectural components (Portals, ESB, Document composition systems, ECM Platform, .)  · Knowledge of runtime platform and products (web and application server, DBMS, )  · Knowledge of operating systems (i.e. Unix, Sun Solaris and Windows) and infrastructure key principles  · Broad and extensive knowledge of the main software development processes (Agile, Waterfall, DevOps)  · Data modeling and database design experience  · Solution evaluation, comparison and business case skills  Best People, Best Training & Best Work: start your adventure at the top Discover how you can bring your ideas and creativity to life in a y  oung, friendly, dynamic and supportive environment . Grow with us and build a fast-moving career supported by  excellent leaders . Thanks to their expertise and a  structured and personalized training , you will learn a unique, widely-recognised  working method that will transform you into a first-class professional. You will manage  complex and challenging projects within an international environment, working in an unrivalled  global network of experts.  Where there are no limits to passion, there is no limit to innovation. Inclusion & Diversity Our  Inclusion & Diversity strategy aims to break down all barriers and eliminate prejudice. We are committed to providing an accessible, inclusive, open and welcoming workplace environment for people with different abilities, backgrounds, lifestyles, sexual orientation, gender identity, needs and expectations, helping all individuals to make the most of their professional potential.  We honor our commitments under articles 1 and 18 of Law No. 68/1999 and give special consideration to candidates in  protected categories .  For further information, visit our website: professioni.accenture.it  For information on our Privacy Protection Safeguards (art13 L.196/03) click here .  Accenture is an equal opportunities employer. Read moreSee All",Technology Advisory Digital Value Architect Manager/Consultant, 5 days ago
,Italy,2784,"[('Headquarters', 'London, United Kingdom'), ('Size', '10000+ employees'), ('Founded', '1989'), ('Type', 'Company - Private'), ('Industry', 'Accounting & Legal'), ('Revenue', '$10+ billion (USD) per year'), ('Competitors', 'Deloitte, KPMG, PwC')]",Ernst & Young,3.8,Italy,"Ernst & Young Nonostante la tecnologia stia cambiando il modo di lavorare, in EY crediamo che il futuro del lavoro dipenda ancora dalle quelle persone che abbiano la capacit unica di porsi le giuste domande in grado di risolvere situazioni complesse in questo momento di trasformazione e costruire quindi un mondo del lavoro migliore.  Se avete passione, curiosit , perseveranza, capacit di analisi critica e problem solving, unite a competenze  digitali come  big data, analystics, blockchain allora  #STEMintotheFuture è levento che stavate aspettando!  Vogliamo incontrare studenti e neo laureati di ambito  STEM (Sciences, Technology, Engineering and Mathematics) per spiegarti come stiamo abbracciando il cambiamento che il mondo del lavoro sta vivendo come conseguenza dellavvento del digitale e come ci stiamo preparando a sviluppare un  nuovo mindset per gestire queste sfide e trasformarle in opportunit , per creare un domani migliore per noi e per le persone intorno a noi.  Sar un ottimo modo per entrare in contatto con noi, perché in EY le persone possono conoscere diverse industry, sperimentare il digitale in ogni sua sfaccettatura, misurare la propria ambizione, valorizzare le competenze che servono per un determinato progetto o attivit , potenziando il proprio sviluppo individuale.  Possono candidarsi al nostro evento le persone iscritteai corsi di laurea in Ingegneria, Matematica e materie scientifiche o neulareati nelle stesse discipline.  Le candidature sono aperte fino al 20 Aprile 2018 e le persone selezionate riceveranno un invito con tutti i dettagli logistici.  #STEMintotheFuture sar il 3 maggio a Milano. Read moreSee All",STEM into the Future, 4 days ago
,Cinisello Balsamo,1737,"[('Headquarters', 'Redwood City, CA'), ('Size', '10000+ employees'), ('Founded', '1977'), ('Type', 'Company - Public\r\n                                    (ORCL)'), ('Industry', 'Information Technology'), ('Revenue', '$10+ billion (USD) per year'), ('Competitors', 'SAP, Salesforce, Microsoft')]",Oracle,3.4,Italy,"Technology Sales Representative IV-18000HR0 Preferred Qualifications*  Senior Sales Representative Cloud, Technology, Middleware, Big Data, Data integration, Security -Italy  Are you as passionate about the Cloud as we are ? Are you a conqueror able to convert strategic  We are seeking a motivated sales individual who can sell our most complete all technology solutions portfolio. You will impress your customers talking about: our market leading database for the Cloud, Middleware Solutions, Cloud Paas and IaaS, BI & Big data, Security, Data Integration, Api, BlockChain Technology, Intelligent Chat bots, DevOpsetc You will help your customers, who have growing data volumes and aggressive service-level expectations, maximize the potential of their IT organizations while delivering the real-time enterprise. Join us and become the trusted advisor of your clients. Responsibilities: Develop Cloud/Database/Middleware/BI/Big data/Securityetc Sales opportunities and maintain customer relationships in a given vertical industry. The right candidate should be able to orchestrate a speech across the complete offering of Oracle in front of a client and work alongside other internal teams to be one Oracle for the customer. Promote and evangelize Oracle products to selected retail customers, partners, and internal audiences- Develop relationships and collaborate with our partners to define, recommend, and drive sales- Develop and execute a sales plan that provides complete territory and sector specific coverage- Develop appropriate sales programs and solutions; maintain up-to-date competitive information and compile regional success stories- Meet with senior customer contacts to build credibility and develop lasting relationships- Engage with Pre-Sales support for customer meetings to develop customer discussions further- Lead successful go-to-market campaigns by working closely with internal marketing specialists- Contribute and lead in account planning, customer/market analysis, and strategy sessions- Contribute individually and as a team member, providing direction and mentoring to others  Required Skills- 5-10 years of experience in direct software sales to complex/Large Enterprises. Local market knowledge and experience is a must- Experience in the Financial Sector industry- Good understanding of the data center customer needs and strong technical expertise to become a trusted advisor across the wide technology portfolio. Proven track record in a sales-driven organization, selling technology-related products and services- Solid written, verbal, and presentation skills- Creative with strong problem-solving skills and an ability to succeed in a fast-paced environment- Proven ability to work well as part of an extended sales team- Knowledge of Oracle products preferred but not essential- Fluency in English and Italian- Team player and self-motivatedAs part of Oracles employment process candidates will be required to complete a pre-employment screening process, prior to an offer being made. This will involve identity and employment verification, salary verification, professional references, education verification and professional qualifications and memberships (if applicable)._ Detailed Description and Job Requirements Sells a subset of product or services directly or via partners to a large number of named accounts/non-named accounts/geographical territory (mainly Tier 3 accounts).  Primary job duty is to sell technology software products and related services in a defined territory. Identifies, qualifies and closes new opportunities. Manages accounts including the entire sales process from business development prospecting and specifications through contract negotiations, signing, and post-sales support. Leverages the Oracle sales model to maximize revenue growth and increase local market share. Builds and expands business partner revenue and self sufficiency.  Leading contributor individually and as a team member, providing direction and mentoring to others. Work is non-routine and very complex, involving the application of advanced technical/business skills in area of specialization. 8 years applicable experience including 7 years of technology sales experience. Ability to forecast, manage sales expenses, and successfully close new Oracle business. Business development, prospecting and presentation skills. Excellent communication skills and problem solving ability. Proven track record of exceeding sales objective and territory/account development. Experience as the focal point for clients for all sales and related issues. Oracle knowledge and/or knowledge of Oracle*s competitors. Travel may be needed. Bachelor degree or equivalent.  As part of Oracle's employment process candidates will be required to complete a pre-employment screening process, prior to an offer being made. This will involve identity and employment verification, salary verification, professional references, educati Read moreSee All",Technology Sales Representative Iv, 1 days ago
,Roma,1737,"[('Headquarters', 'Redwood City, CA'), ('Size', '10000+ employees'), ('Founded', '1977'), ('Type', 'Company - Public\r\n                                    (ORCL)'), ('Industry', 'Information Technology'), ('Revenue', '$10+ billion (USD) per year'), ('Competitors', 'SAP, Salesforce, Microsoft')]",Oracle,3.4,Italy,"Cloud Platform Sales Representative Italy-18000JBX Preferred Qualifications*  Senior Sales Representative Cloud, Technology, Middleware, Big Data, Data integration, Security - Commercial Accounts - Milan  Are you as passionate about the Cloud as we are ?  We are seeking a motivated sales individual who can sell our most complete all technology solutions portfolio to a number of customers cross industry in Italy. You will impress your customers talking about: our market leading database for the Cloud, Middleware Solutions, Cloud Paas and IaaS, BI & Big data, Security, Data Integration, Api, BlockChain Technology, Intelligent Chat bots, DevOpsetc You will help your customers, who have growing data volumes and aggressive service-level expectations, maximize the potential of their IT organizations while delivering the real-time enterprise. Join us and become the trusted advisor of your clients. Responsibilities: Develop Cloud/Database/Middleware/BI/Big data/Securityetc Sales opportunities and maintain customer relationships in your given territory. The right candidate should be able to orchestrate a speech across the complete offering of Oracle in front of a client and work alongside other internal teams to be one Oracle for the customer. Promote and evangelize Oracle products to selected retail customers, partners, and internal audiences- Develop relationships and collaborate with our partners to define, recommend, and drive sales- Develop and execute a sales plan that provides complete territory and sector specific coverage- Develop appropriate sales programs and solutions; maintain up-to-date competitive information and compile regional success stories- Meet with senior customer contacts to build credibility and develop lasting relationships- Engage with Pre-Sales support for customer meetings to develop customer discussions further- Lead successful go-to-market campaigns by working closely with internal marketing specialists- Contribute and lead in account planning, customer/market analysis, and strategy sessions- Contribute individually and as a team member, providing direction and mentoring to others  Required Skills- 5 + years of experience in direct software sales to Education sector in all of Italy. Local market knowledge and experience is a must- Good understanding of the data center customer needs and strong technical expertise to become a trusted advisor across the wide technology portfolio. Proven track record in a sales-driven organization, selling technology-related products and services- Solid written, verbal, and presentation skills- Creative with strong problem-solving skills and an ability to succeed in a fast-paced environment- Proven ability to work well as part of an extended sales team- Knowledge of Oracle products preferred but not essential- Fluency in English and Italian- Team player and self-motivated- Eligible to work in Italy. We do not sponsor work permitAs part of Oracles employment process candidates will be required to complete a pre-employment screening process, prior to an offer being made. This will involve identity and employment verification, salary verification, professional references, education verification and professional qualifications and memberships (if applicable)._ Detailed Description and Job Requirements Sells a subset of product or services directly or via partners to a large number of named accounts/non-named accounts/geographical territory (mainly Tier 3 accounts).  Primary job duty is to sell technology software products and related services in a defined territory. Identifies, qualifies and closes new opportunities. Manages accounts including the entire sales process from business development prospecting and specifications through contract negotiations, signing, and post-sales support. Leverages the Oracle sales model to maximize revenue growth and increase local market share. Builds and expands business partner revenue and self sufficiency.  Leading contributor individually and as a team member, providing direction and mentoring to others. Work is non-routine and very complex, involving the application of advanced technical/business skills in area of specialization. 8 years applicable experience including 7 years of technology sales experience. Ability to forecast, manage sales expenses, and successfully close new Oracle business. Business development, prospecting and presentation skills. Excellent communication skills and problem solving ability. Proven track record of exceeding sales objective and territory/account development. Experience as the focal point for clients for all sales and related issues. Oracle knowledge and/or knowledge of Oracle*s competitors. Travel may be needed. Bachelor degree or equivalent.  As part of Oracle's employment process candidates will be required to complete a pre-employment screening process, prior to an offer being made. This will involve identity and employment verification, salary Read moreSee All",Cloud Platform Sales Representative Italy, 1 days ago
,Milano,10546,"[('Headquarters', 'Milan, Italy'), ('Size', '10000+ employees'), ('Founded', 'Unknown'), ('Type', 'Company - Public\r\n                                    (UCG)'), ('Industry', 'Finance'), ('Revenue', '$10+ billion (USD) per year'), ('Competitors', 'Unknown')]",UniCredit,3.3,Italy,".  Area description  Corporate & Investment Banking (CIB) is a cross-country division of our Group which services the financial needs of small-medium enterprises, large corporates, multinationals, financial institutions, investors and commercial banking customers through corporate and transaction banking as well as structured finance, capital markets and investment products. CIB provides all the ICT solution to support the Business.  Under CIB ICT area a new innovative area was created""Trade Finance Development"" Competence Area ensures a global ICT services supply aimed at managing all Trade Finance innovative solutions in CIB area. The Competence Area is, thus, responsible for: Providing ICT applications aimed at developing, implementing and managing (run and change) the solutions in terms of ""Trade finance Innovative solution prototyping"".Cooperating with the competent Holding functions in the definition of developing an holistic approach to the management, processing, integration and analysis of data;Fostering and delivering innovation as a service, mainly on data-driven processes, nurturing the necessary skills through continuous industrial scouting on technological frameworks and methodological innovation. Function description  The person will be part of a young and dynamic team and will mainly deal with the creation of sketch, wireframe, prototype and visual mock-ups for iOS applications  Job description Support in the scouting of new generation products and/or platforms aimed to innovate and optimize the management of the application;Research activities across blockchain and distributed ledger across multiple domains, creation and documentation of relevant frameworks and solutionsIdentification of new improvement areas and opportunities, planning the necessary assessments and building up evolution drafts and addressing new proposals;Support on integration and/or rationalization initiatives of legacy systems;Support on integration and/or rationalization initiatives What we expect from you  .  Economics degree  Information Technologies fundamentals.  Proactive and problem solving skills  Capabiliy to work in team and across multiple domain.  Capability to work under pressure and within strict deadline.  Previous blockchain knowledge is not required but a plus.  Ability to logically analyze large amounts of information.  Capability to prioritize and to multi-task.  Ability to co-operate in international teams  What we offer to you  You will be challenged with a unique experience in a team-oriented, dynamic and international environment where you will have the chance to get a deep knowledge of a brand new bank mobile app development program. Read moreSee All",Trade Finance, 1 days ago
,Milano,2784,"[('Headquarters', 'London, United Kingdom'), ('Size', '10000+ employees'), ('Founded', '1989'), ('Type', 'Company - Private'), ('Industry', 'Accounting & Legal'), ('Revenue', '$10+ billion (USD) per year'), ('Competitors', 'Deloitte, KPMG, PwC')]",EY,3.8,Italy,"EY si definisce attraverso i suoi valori di integrità, trasparenza e passione. EY si concretizza attraverso il lavoro che tutti i giorni portiamo avanti con i nostri clienti, istituzioni e comunità, con i quali utilizziamo le nostre competenze di Assurance, Advisory e Transaction per creare un cambiamento positivo vicino a casa e nel mondo. Significa raccontare come guidiamo il cambiamento tecnologico e digitale per migliorare quello che ci circonda e costruire un Better Working World. Advisory Performance Improvement è un universo di diverse expertise che aiuta I clienti a capitalizzare opportunità di crescita e ottimizzare i loro processi, qualunque sia la loro industry anche attraverso AI, Blockchain, Automation, Analytics e Digital.  Con l’obiettivo di potenziare il team Advisory Performance Improvement per la sua sede di Milano ricerca un/una Senior Consultant – ambito Finance La risorsa verrà inserita in progetti internazionali, definendo e coordinando la trasformazione dei principali processi in ambito Finance.  Si occuperà di:  · revisione, organizzazione e ottimizzazione dei processi di pianificazione e reporting in ambito finance;  · definizione di modelli di controllo  · validazione dei nuovi processi, compresa la progettazione di KPI per misurarne l'efficacia e l'efficienzaIl candidato ideale ha maturato una precedente esperienza, 4-5 anni, presso società di consulenza internazionali, soprattutto in ambito industrial/consumer/products e possiede le conoscenze in ambito di: Controllo di gestione (revisione modello di controllo, disegno di Business Blue Print sui principali sistemi ERP, disegno reportistica e dashboarding)Sistemi di Business Intelligence e/o CPM (Tagetik, Oracle)Principi contabili (IFRS15/16) Sono richiesti inoltre una fluente conoscenza della lingua inglese la possibilità di ingaggio immediato.  Offriamo:  • percorso formativo strutturato e di alto livello  • ambiente stimolante  • progetti innovativi  Sede di lavoro:  • Milano. È richiesta la disponibilità a viaggiare in Italia e all'estero  I candidati interessati sono invitati a inviare un C.V. dettagliato indicando la posizione di interesse e specificando l'autorizzazione al trattamento dei dati personali ai sensi della legge sulla Privacy (L. 196/03).  Ai sensi della normativa vigente l'offerta di lavoro si intende estesa a entrambi i sessi (L 903/77).  Inviare dettagliato cv, autorizzando al trattamento dei dati personali. La ricerca si intende rivolta a persone di entrambi i sessi (L. 903/77) Read moreSee All",Senior Consultant – ambito Finance, 27 days ago
